question,answer
How many days of medical leave do I have?,All staff are entitled to 14 days of medical leave.
How many days of medical leave can I apply?,All staff are entitled to 14 days of medical leave.
Is there a limit to the number of medical leave I can apply?,All staff are entitled to 14 days of medical leave.
Can I claim medical expenses from a TCM doctor? ,Please note that Traditional Chinese Medicine (TCM) treatments are NOT claimable. 
I visited TCM doctor recently. Can medical fees be reimbursed?,Please note that Traditional Chinese Medicine (TCM) treatments are NOT claimable. 
